{
  "schemaVersion": "1.0.0",
  "status": "blocked_missing_user_config",
  "evidenceClass": "development_synthetic",
  "decision": "unproven",
  "metrics": null,
  "failureCases": [],
  "realProviderHostSmoke": "blocked_missing_user_config",
  "developmentSemanticMetrics": "blocked_missing_user_config",
  "externalUserUsability": "unproven",
  "realSecondUse": "unproven",
  "marketEvidence": "unproven",
  "testLockHash": "645fd9aad1786f3106d640f5ff60c4b3b8328e0435ed9dd54d300f4852a2f0c2",
  "candidateProvenance": null
}
